id,nazwa,cena,skladniki,url,typ_wlosow,typ_skory,porowatosc
102,DX2,25,"Aqua, Sodium Laureth Sulfate, Sodium Lauroyl Methyl Isethionate, Acrylates Copolymer, Propylene Glycol, Aloe Barbadensis Leaf Juice, Propylene Glycol/ Alcohol Denat./ Faex Extract, Polyquaternium-7, Methylpropanediol/ Caprylyl Glycol/ Phenylpropanol, PEG-4 Rapeseedamide, Panthenol, Acrylates/C10-30 Alkyl Acrylate Crosspolymer, Piroctone Olamine, Sodium Lactate/ Sodium PCA/ Glycine/ Fructose/ Urea/ Niacinamide/ Inositol/ Lactic Acid, Glycerin/ Propylene Glycol/ Bacillus Ferment, Olive Oil PEG-8 Esters, Climbazole, Sodium Hydroxide, Disodium EDTA, Parfum, Limonene, Linalool",https://www.hebe.pl/dx2-przeciwlupiezowy-szampon-do-wlosow-150-ml-000000000000273817.html
103,so!flow,26,"Aqua,Sodium Laureth Sulfate,Cocamidopropyl Betaine,PPG-3 Caprylyl Ether,PEG-12 Dimethicone,Coco Glucoside,Glyceryl Oleate,Hydrolyzed Jojoba Esters,Rhodiola Rosea Root Extract,Rubus Villosus Fruit Extract,Prunus Domestica Fruit Extract,Inulin,Hydrolyzed Vegetable Protein PG-Propyl Silanetriol,Polyquaternium-10,Sodium Lauroyl Methyl Isethionate,Hydrogenated Palm Glycerides Citrate,Citric Acid,Glycerin,Disodium EDTA,Trisodium Ethylenediamine Disuccinate,Tocopherol,Sodium Chloride,Parfum,Sodium Benzoate,Potassium Sorbate,CI 19140,CI 17200,CI 42090",https://www.hebe.pl/soflow-rewitalizujacy-szampon-do-wlosow-400-ml-000000000000410517.html
104,Vichy Dercos,65,"AQUA/WATER, SODIUM LAURETH SULFATE, CITRIC ACID, DISODIUM COCOAMPHODIACETATE, GLYCOL DISTEARATE, SODIUM CHLORIDE, AMMONIUM HYDROXIDE, CARBOMER, DIAMINOPYRIMIDINE OXIDE, DISODIUM RICINOLEAMIDO MEA SULFOSUCCINATE, HEXYLENE GLYCOL, NIACINAMIDE, PANTHENOL, PEG-55 PROPYLENE GLYCOL OLEATE, POLYQUATERNIUM-10, PROPYLENE GLYCOL, PYRIDOXINE HCI, SALICYLIC ACID, SODIUM BENZOATE, SODIUM GLYCOLATE, SODIUM HYDROXIDE, PARFUM/FRAGRANCE.",https://www.hebe.pl/vichy-szampon-do-wlosow-200ml-000000000000225639.html
105,Syoss Oleo Intense,19,"Aqua (Water, Eau), Sodium Laureth Sulfate, Sodium Chloride, Cocamidopropyl Betaine, Sunflower Seed Oil PEG-8 Esters, Hydrolyzed Keratin, Sodium Benzoate, Parfum (Fragrance), Coco-Glucoside, Glyceryl Oleate, PEG-7 Glyceryl Cocoate, Citric Acid, Hydroxypropyl Guar Hydroxypropyltrimonium Chloride, PEG-40 Hydrogenated Castor Oil, PEG-120 Methyl Glucose Dioleate, Linalool, Tetramethyl Acetyloctahydronaphthalenes, Propylene Glycol, Linalyl Acetate, Sodium Hydroxide, Limonene, Benzyl Alcohol, Camellia Oleifera Seed Oil, Calophyllum Inophyllum Seed Oil, Perilla Frutescens Seed Oil, Prunus Serrulata Flower Extract, CI 47005, CI 15985 (Yellow 6)",https://www.hebe.pl/syoss-szampon-do-wlosow-suchych-i-matowych-440-ml-000000000000438683.html
108,Venita Cebula,12,"AQUA, SODIUM LAURETH SULFATE, COCAMIDOPROPYL BETAINE, SODIUM CHLORIDE, PEG-4 RAPESEEDAMIDE, COCO-GLUCOSIDE, CETRIMONIUM CHLORIDE, DICAPRYLYL ETHER, DECYL GLUCOSIDE, GLYCERYL OLEATE, PROPYLENE GLYCOL, GLYCERIN,  ALLIUM CEPA BULB EXTRACT, PANTHENOL, ROSMARINUS OFFICINALIS LEAF EXTRACT, CHAMOMILLA RECUTITA FLOWER EXTRACT, ARNICA MONTANA FLOWER EXTRACT, LAMIUM ALBUM EXTRACT, SALVIA OFFICINALIS LEAF EXTRACT, PINUS SYLVESTRIS BUD EXTRACT, NASTURTIUM OFFICINALE EXTRACT, ARCTIUM MAJUS ROOT EXTRACT, CITRUS LIMON PEEL EXTRACT, HEDERA HELIX LEAF EXTRACT, CALENDULA OFFICINALIS FLOWER EXTRACT, TROPAEOLUM MAJUS FLOWER EXTRACT, PEG-40 HYDROGENATED CASTOR OIL, CITRIC ACID, METHYLCHLOROISOTHIAZOLINONE, METHYLISOTHIAZOLINONE, PARFUM, CI 17200, CI 16255, CI 42090, HEXYL CINNAMAL, LIMONENE, LINALOOL.",https://www.hebe.pl/venita-trychologiczny-szampon-do-wlosow-przetluszczajacych-sie-z-tendencja-do-wypadania-300-ml-000000000000540658.html
109,Gliss Liquid Silk,17,"Aqua (Water, Eau),Sodium Laureth Sulfate,Sodium Chloride,Cocamidopropyl Betaine,Glycosphingolipids,Hydrolyzed Silk,Sericin,Hydrolyzed Keratin,Parfum (Fragrance),PEG-7 Glyceryl Cocoate,Polyquaternium-10,Sodium Benzoate,PEG-120 Methyl Glucose Dioleate,Coco-Glucoside,Glyceryl Oleate,Citric Acid,PEG-40 Hydrogenated Castor Oil,Glycol Distearate,Hydrogenated Castor Oil,Butylene Glycol,Laureth-4,Prunus Armeniaca (Apricot) Kernel Oil,Propylene Glycol,Sodium Hydroxid,Benzyl Alcohol,Phenoxyethanol,Potassium Sorbate,Methylparaben,Propylparaben",https://www.hebe.pl/gliss-kur-szampon-do-wlosow-400ml-000000000000217458.html
110,Ziaja Yego Czerwony Cedr,11,"Aqua (Water), Cocamidopropyl Betaine, Disodium Laureth Sulfosuccinate, Decyl Glucoside, Glycerin, Laureth-2, Guar Hydroxypropyltrimonium Chloride, Niacinamide, Calcium Pantothenate, Sodium Ascorbyl Phosphate, Tocopheryl Acetate, Pyridoxine HCl, Maltodextrin, Sodium Starch Octenylsuccinate, Silica, C12-13 Alkyl Lactate, PEG-120 Methyl Glucose Dioleate, Sodium Benzoate, Parfum (Fragrance), Limonene, Citronellol, Coumarin, Citric Acid.",https://www.hebe.pl/ziaja-odswiezajacy-i-oczyszczajacy-zel-pod-prysznic-z-szamponem-o-zelowej-konsystencji-400-ml-000000000000422462.html
112,Herbaria Banfi,33,"Aqua, Sodium Laureth Sulfate, Glycerin, Cocamidopropyl Betaine, Cocamide-DEA, Coco-Glucoside, PEG-7 Glyceryl Cocoate, Alcohol, Parfum, Cochlearia Armoracia Extract (ekstrakt z chrzanu), Sodium Chloride, Sorbitan Caprylate, Panthenol, Glyceryl Oleate, Propanediol, Benzoic Acid, Citric Acid, Juniperus Communis Extract (ekstrakt z jałowca), Brassica Alba Extract (ekstrakt z gorczycy), PEG-40 Hydrogenated Castor Oil, Origanum Majorana Extract (ekstrakt z majeranku), Phenoxyethanol, Ethylhexylglycerin, Tocopherol, Hydrogenated Palm Glycerides Citrate, Cl 42051, Cl 19140, Limonene, Linalool, Hexyl Cinnamal, Citral, Geraniol.",https://www.hebe.pl/herbaria-oczyszczajacy-szampon-do-wlosow-250-ml-000000000000428721.html
115,L'biotica Biovax Trychologic,22,"Aqua,Sodium Laureth Sulfate,Lauryl Glucoside,Cocamidopropyl Betaine,Glycerin,Sorbitol,Piroctone Olamine,Coco- Glucoside,Glyceryl Oleate,PEG-7 Glyceryl Cocoate,Cetrimonium Chloride,Polyquaternium-10,Lactobacillus Ferment,Panthenol,Tocopherol,succinic acid,Hydroxyethyl Urea,Xylitylglucoside,Anhydroxylitol,Xylitol,Hydrogenated Palm Glycerides Citrate,Lecithin,Ascorbyl Palmitate,Citric Acid,TETRASODIUM GLUTAMATE DIACETATE,Sodium Benzoate,Potassium Sorbate,Parfum,Geraniol,hexyl cinnamal",https://www.hebe.pl/lbiotica-biovax-szampon-do-wlosow-i-skory-glowy-przeciw-lupiezowi-200-ml-000000000000453665.html
116,Yolyn Wow,24,"Aqua (Water), Sodium Cocoyl Isethionate, Cocamidopropyl Betaine, Lauryl Glucoside, Sodium Chloride, Dimethiconol, Parfum (Fragrance), Sodium Benzoate, Citric Acid, Quaternium-80, Potassium Sorbate, Tetrasodium Glutamate Diacetate, Prunus Amygdalus Dulcis (Sweet Almond) Oil, Persea Gratissima (Avocado) Oil, Panthenol, PEG-7 Glyceryl Cocoate, Hexamethylindanopyran, Caprylyl/Capryl Glucoside, Vanillin, Trehalose, Propylene Glycol, Phenoxyethanol, Benzyl Alcohol, Hydrolyzed Oat Protein, Hydrolyzed Keratin, Gluconolactone, Dipotassium EDTA, Phenethyl Alcohol, Caprylyl Glycol, Calcium Gluconate, Tocopherol",https://www.hebe.pl/yolyn-wygladzajacy-szampon-do-wlosow-450-ml-000000000000595620.html
119,Hebe Cosmetics Hydrating Shampoo,9,"Aqua, Sodium Coco-Sulfate, Glycerin, Decyl Glucoside, Cocamidopropyl Betaine, Lauryl Glucoside, Coco-Glucoside, Glyceryl Oleate, Aloe Barbadensis Leaf Juice, Cananga Odorata Flower Extract, Nelumbo Nucifera Flower Extract, Parfum, Citric Acid, Sodium Benzoate, Potassium Sorbate, Propylene Glycol.",https://www.hebe.pl/hebe-cosmetics-nawilzajacy-szampon-do-wlosow-400-ml-000000000000408102.html
120,Kundal Honey & Macadamia,69,"Water,Disodium Laureth Sulfosuccinate,Glycerin,Lauryl Glucoside,Lauryl Betaine,Decyl Glucoside,1,2-Hexanediol,Honey Extract,Macadamia Ternifolia Seed Extract,Hydrolyzed Keratin,Hydrolyzed Silk,Milk Protein Extract,Copper Tripeptide-1,Butyrospermum Parkii (Shea) Butter,Argania Spinosa Kernel Oil,Simmondsia Chinensis (Jojoba) Seed Oil,Cocos Nucifera (Coconut) Oil,Persea Gratissima (Avocado) Oil,Diospyros Kaki Fruit Extract,Camellia Japonica Leaf Extract,Ceratonia Siliqua (Carob) Fruit Extract,Centella Asiatica Extract,Camellia Sinensis Leaf Extract,Polygonum Cuspidatum Root Extract,Scutellaria Baicalensis Root Extract,Glycyrrhiza Glabra (Licorice) Root Extract,Rosmarinus Officinalis (Rosemary) Leaf Extract,Chamomilla Recutita (Matricaria) Flower Extract,Rosa Damascena Flower Extract,Arnica Montana Flower Extract,Sophora Angustifolia Root Extract,Acorus Calamus Root Extract,Polygonum Multiflorum Root Extract,Morus Alba Root Extract,Swertia Japonica Extract,Yucca Schidigera Root Extract,Brassica Campestris (Rapeseed) Sprout Extract,Brassica Oleracea Italica (Broccoli) Sprout Extract,Glycine Soja (Soybean) Sprout Extract,Triticum Vulgare (Wheat) Sprout Extract,Magnolia Kobus Bark Extract,Salix Alba (Willow) Bark Extract,Cinnamomum Cassia Bark Extract,Portulaca Oleracea Extract,Chamaecyparis Obtusa Leaf Extract,Origanum Vulgare Leaf Extract,Lactobacillus/Soybean Ferment Extract,Butylene Glycol,Polyquaternium-10,Sodium Chloride,Sodium Sulfite,Citric Acid,Arginine,Disodium EDTA,Fragrance",https://www.hebe.pl/kundal-odswiezajacy-szampon-do-wlosow-z-bialym-pizmem-500-ml-000000000000365135.html
121,Tołpa Green Wzmacnianie,22,"Aqua, Lauryl Glucoside, Sodium Coco-Sulfate, Glycerin, Polyglyceryl-4 Caprate, Betaine, Cannabis Sativa Seed Oil, Persea Gratissima Oil, Olus Oil, Tocopherol, Peat Extract, Hydroxypropyl Guar Hydroxypropyltrimonium Chloride, Lactic Acid, Parfum, Methylpropanediol, Benzoic Acid, Caprylyl Glycol, Triethyl Citrate, Glyceryl Caprylate.",https://www.hebe.pl/tolpa-szampon-do-wlosow-slabych-zniszczonych-i-pozbawionych-witalnosci-300-ml-000000000000385903.html
122,Dermedic Capilarte,47,"Aqua, Sodium Laureth Sulfate, Cocamidopropyl Betaine, Coco-Glucoside, Sodium Chloride, Caffeine, Glycerin, Panthenol, Polyquaternium-7, PEG-7 Glyceryl Cocoate, Glycol Distearate, Laureth-4, Benzoic Acid, Glycolic Acid, Sodium Lactate, Lactic Acid, Butylene Glycol, PPG-26-Buteth-26, PEG-40 Hydrogenated Castor Oil, Apigenin, Oleanolic Acid, Biotinoyl Tripeptide-1, Malus Domestica Fruit Cell Culture Extract, Xanthan Gum, Lecithin, Phenoxyethanol, Niacinamide, Calcium Pantothenate, Sodium Ascorbyl Phosphate, Tocopheryl Acetate, Pyridoxine HCl, Maltodextrin, Sodium Starch Octenylsuccinate, Silica, Ocimum Basilicum Hairy Root Culture Extract, Alcohol, Zinc PCA, Guar Hydroxypropyltrimonium Chloride, Citric Acid, Parfum, Benzyl Benzoate, Benzyl Salicylate, Butylphenyl Methylpropional, Linalool, Potassium Sorbate, Sodium Benzoate.",https://www.hebe.pl/dermedic-szampon-kuracja-stymulujacy-wzrost-wlosow-300ml-000000000000303799.html
123,Yumi Winogronowa Regeneracja,22,"Aqua, Sodium Coco-Sulfate, Cocamidopropyl Betaine, Aloe Barbadensis Leaf Juice, Vitis Vinifera Fruit Extract, Glycerin, Hydrolyzed Corn Protein, Hydrolyzed Wheat Protein, Hydrolyzed Soy Protein, Leuconostoc/Radish Root Ferment Filtrate, Hydrogenated Vegetable Glycerides Citrate, Rubus Idaeus Fruit Extract, Pyrus Communis Fruit Extract, Citrus Grandis Fruit Extract, Lauryl Glucoside, Coco-Glucoside, Glyceryl Oleate, Tocopherol, Gluconolactone, Hydroxypropyl Guar Hydroxypropyltrimonium Chloride, Lactic Acid, Disodium EDTA, Citric Acid, Sodium Chloride, Parfum, Sodium Benzoate, Potassium Sorbate.",https://www.hebe.pl/yumi-regenerujacy-szampon-do-wlosow-300-ml-000000000000407624.html
124,Tołpa Green Regeneracja,22,"Aqua, Lauryl Glucoside, Sodium Coco-Sulfate, Glycerin, Prunus Armeniaca Kernel Oil, Prunus Amygdalus Dulcis Oil, Olus Oil, Tocopherol, Polyglyceryl-4 Caprate, Betaine, Peat Extract, Hydroxypropyl Guar Hydroxypropyltrimonium Chloride, Lactic Acid, Parfum, Methylpropanediol, Benzoic Acid, Caprylyl Glycol, Triethyl Citrate, Glyceryl Caprylate.",https://www.hebe.pl/tolpa-szampon-do-wlosow-suchych-matowych-i-puszacych-sie-300-ml-000000000000385948.html
125,Gliss Colour Perfector,17,"Aqua (Water, Eau),Sodium Laureth Sulfate,Cocamidopropyl Betaine,PEG-7 Glyceryl Cocoate,Magnesium Chloride,Dimethicone,Vaccinium Macrocarpon (Cranberry) Fruit Extract,Dimethylsilanol Hyaluronate,Glycerin,Hydrolyzed Keratin,Magnesium Citrate,Parfum (Fragrance),Sodium Benzoate,PEG-120 Methyl Glucose Dioleate,Amodimethicone,Citric Acid,Sodium Chloride,Guar Hydroxypropyltrimonium Chloride,PEG-40 Hydrogenated Castor Oil,Hydrogenated Castor Oil,Glycol Distearate,Laureth-4,Prunus Armeniaca (Apricot) Kernel Oil,Laureth-23,Trideceth-10,Sodium Hydroxide,Propylene Glycol,Benzyl Alcohol,Phenoxyethanol,Sodium Salicylate,Potassium Sorbate,Sorbic Acid",https://www.hebe.pl/gliss-kur-szampon-do-wlosow-400ml-000000000000220270.html
